{
  "person_id": "i-yeonghui-1910",
  "source_url": "https://www.assembly.go.kr/static/portal/img/openassm/R4T6466C.jpg",
  "license": "permitted",
  "attribution": "국회",
  "decision": "2026-10-07 운영자 결정. 국회 홈페이지에 공개된 의원 사진을 출처(국회)를 적고 흑백으로 씀. 국회사무처의 이용 허락 회신 전에 정한 잠정 결정이라 문제가 생기면 unconfirmed로 내리고 바로 비공개함",
  "source_urls": [
    "https://open.assembly.go.kr/portal/data/service/selectServicePage.do/OOWY4R001216HX11439"
  ],
  "verified": false,
  "checked_at": "2026-11-01"
}
